{
  "schema_version": 1,
  "id": "multi-agent-authorization-required",
  "request": {
    "schema_version": 1,
    "work": {
      "id": "multi-agent-authorization-required",
      "objective": "Challenge a material implementation.",
      "requested_action": "modify",
      "scope": [],
      "affected_components": []
    },
    "governance": {
      "risk_flags": [],
      "required_gates": [
        "second-context"
      ],
      "required_evidence": [],
      "project_sources": []
    },
    "host": {
      "concurrency_limit": 2,
      "distinct_context_limit": 2,
      "multi_agent_authorization": "unknown"
    },
    "state": {
      "current_role": "developer",
      "current_stage": "produce"
    }
  },
  "expected": {
    "status": "decision-required",
    "participant": null,
    "assurance_mode": "unavailable"
  }
}
