{
  "schema_version": 1,
  "id": "multi-agent-authorization-denied",
  "request": {
    "schema_version": 1,
    "work": {
      "id": "multi-agent-authorization-denied",
      "objective": "Verify a change requiring independent assurance.",
      "requested_action": "verify",
      "scope": [],
      "affected_components": []
    },
    "governance": {
      "risk_flags": [],
      "required_gates": [
        "independent-testing-from-developer",
        "independent-review-from-developer"
      ],
      "required_evidence": [
        "tests"
      ],
      "project_sources": []
    },
    "host": {
      "concurrency_limit": 3,
      "distinct_context_limit": 3,
      "multi_agent_authorization": "denied"
    },
    "state": {
      "current_role": "tester",
      "current_stage": "verify"
    }
  },
  "expected": {
    "status": "blocked",
    "participant": null,
    "assurance_mode": "unavailable"
  }
}
